Barýþ ve savaþ arasýndaki salýnýmlar, ekonomik patlama ve çöküþ, siyasi sol ve siyasi saðýn iktidarda olmasý, imparatorluklarýn birleþmesi ve daðýlmasý, vb — tipik olarak insanlar olaylarý denge seviyelerini aþan uç noktalara ittikleri için meydana gelir, bu da ters yönde aþýrýya kaçan salýnýmlara yol açar.
Üretkenlik, yani öðrenme, inþa etme ve buluþçuluðun yönlendirdiði kiþi baþýna çýktý, zaman içinde istikrarlý bir þekilde artmýþtýr. Bununla birlikte, farklý insanlar için farklý oranlarda yükselmiþ olsa da, her zaman ayný nedenlerle — insanlarýn eðitim kalitesi, buluþçuluðu, iþ ahlaký ve fikirleri çýktýya dönüþtüren ekonomik sistemler nedeniyle — yükselmiþtir.
Bu tür evrimsel geliþmeleri hemen hemen her þeyde görüyoruz — daha uzun yaþam beklentisi, daha iyi ürünler, iþleri yapmanýn daha iyi yollarý vb. Geliþme biçimimiz bile yaratma ve yenilik yapmanýn daha iyi yollarýný bulma þeklinde evrimleþmiþtir. Bu durum, insanlýk tarihi yazýldýðý sürece geçerli olmuþtur. Bunun bir sonucu olarak, çoðu þeyin grafikleri yukarý ve aþaðý hareketlerden ziyade geliþime doðru daha fazla yukarý eðim gösterir.
Kapitalizmin, giriþimciliðin ve Sanayi Devrimi’nin icadýyla gelen üretkenlikteki daha geniþ tabanlý geliþmeler, serveti ve gücü, toprak sahipliðinin temel güç kaynaðý olduðu ve hükümdarlarýn, soylularýn ve din adamlarýnýn bu gücü ellerinde tutmak için birlikte çalýþtýðý tarýma dayalý bir ekonomiden uzaklaþtýrdý.
Etrafýnda büyük döngüler olan bu evrimin nasýl gerçekleþtiði de geliþmeye devam ediyor. Örneðin, çaðlar önce tarým arazileri ve tarýmsal üretim en deðerli þeyken ve bu durum makinelere ve ürettiklerinin en deðerli þey olmasýna evrilmiþken, görünürde fiziksel bir varlýðý olmayan dijital þeyler (veri ve bilgi iþleme) þimdi en deðerli þey olmaya doðru evrilmektedir.[1] Bu durum, veriyi kimin elde edeceði ve bunu zenginlik ve güç kazanmak için nasýl kullanacaðý konusunda bir mücadele yaratmaktadýr.
Görebileceðiniz þey, etrafýnda büyük döngülerle ilerleyen evrimdir. Zaman boyunca baþarýnýn formülü, birbirleriyle medeni bir þekilde çalýþan iyi eðitimli insanlarýn yenilikler bulduðu, sermaye piyasalarý aracýlýðýyla finansman saðladýðý ve yeniliklerinin kaynaklarýn üretimine ve tahsisine dönüþmesini saðlayan araçlara sahip olduðu ve kar elde ederek ödüllendirildiði bir sistem olmuþtur.
Büyük tasarruflara, düþük borçlara ve güçlü bir rezerv para birimine sahip ülkeler, fazla tasarrufu olmayan, çok fazla borcu olan ve güçlü bir rezerv para birimine sahip olmayan ülkelere göre ekonomik ve kredi çöküþlerine daha iyi dayanabilir. Ayný þekilde güçlü ve yetenekli liderliðe ve sivil nüfusa sahip olanlar, bunlara sahip olmayanlardan daha iyi yönetilebilir ve daha yaratýcý olanlar, daha az yaratýcý olanlardan daha iyi uyum saðlayacaktýr. Daha sonra göreceðiniz gibi, bu faktörler ölçülebilir, zamansýz ve evrensel gerçeklerdir.
Savaþýn sonunda kiþi baþýna düþen küresel GSYH yaklaþýk yüzde 12 oranýnda düþmüþtü ve bunun büyük bir kýsmý savaþý kaybeden ülkelerin ekonomilerindeki düþüþlerden kaynaklanýyordu. Bu yýllarýn temsil ettiði stres testi pek çok þeyi silip süpürdü, kazananlarýn ve kaybedenlerin kim olduðunu netleþtirdi ve 1945'te yeni bir baþlangýca ve yeni bir dünya düzenine yol açtý. Klasik olarak bunu uzun bir barýþ ve refah dönemi takip etti ve bu dönem aþýrý geniþledi, öyle ki tüm ülkeler 75 yýl sonra yeniden stres testine tabi tutuluyor.
1930'larýn ABD örneðinde, borsa ve ekonomi, yeni seçilen baþkan Franklin D. Roosevelt’in, hükümetin insanlarýn paralarýný altýn karþýlýðýnda teslim etmelerine izin verme sözünü tutmayacaðýný ve hükümetin insanlarýn paralarýný bankalardan çekebilmeleri ve diðerlerinin de bir þeyler satýn almak ve yatýrým yapmak için para ve kredi alabilmeleri için yeterli para ve kredi yaratacaðýný açýkladýðý gün dibe vurdu.
"1907–19 dönemi ABD’de 1907 Paniði ile baþlamýþ ve týpký Kükreyen 20'li yýllarý takip eden 1929–32 para ve kredi krizi gibi, bir patlama döneminin (ABD’de Yaldýzlý Çað, kýta Avrupa’sýnda Belle Époque ve Büyük Britanya’da Viktorya Dönemi ile ayný zamana denk geliyordu) borçla finanse edilen bir balona dönüþmesi sonucunda ekonomik ve piyasa düþüþlerine yol açmýþtý. Bu düþüþler ayný zamanda büyük servet farklarýnýn olduðu, büyük servet yeniden daðýtýmlarýna yol açan ve bir dünya savaþýna katkýda bulunan bir dönemde gerçekleþti. Servetin yeniden daðýtýmý, 1930–45 döneminde olduðu gibi, vergilerde ve hükümet harcamalarýnda büyük artýþlar, büyük açýklar ve açýklarý parasallaþtýran para politikalarýnda büyük deðiþiklikler yoluyla gerçekleþti. Ardýndan Ýspanyol gribi stres testini ve bunun sonucunda ortaya çýkan yeniden yapýlandýrma sürecini yoðunlaþtýrdý. Bu stres testi ve küresel ekonomik ve jeopolitik yeniden yapýlanma, 1919'da Versay Antlaþmasý’nda ifade edilen yeni bir dünya düzenine yol açtý. Bu da 1920'lerin borçla finanse edilen patlamasýný baþlatmýþ, bu da 1930–45 dönemine ve ayný þeylerin tekrar yaþanmasýna yol açmýþtýr. Bu yýkým/yeniden inþa dönemleri zayýflarý yýkýma uðrattý, güçlülerin kim olduðunu netleþtirdi ve iþlerin yapýlmasýna yönelik devrim niteliðinde yeni yaklaþýmlar (yani yeni düzenler) oluþturdu; bu da sonunda büyük servet uçurumlarýna sahip borç balonlarý olarak aþýrý geniþleyen refah dönemlerine zemin hazýrladý ve yeni stres testleri ve yýkým/yeniden inþa dönemleri (yani savaþlar) üreten borç baskýnlarýna yol açtý; bu da yeni düzenlere ve sonunda güçlülerin zayýflara göre yeniden kazanmasýna ve bu þekilde devam etmesine yol açtý."
Ülkeler arasýnda meydana gelen zenginlik ve güç deðiþimlerini göstermiyor. Bunlarýn nasýl gerçekleþtiðini anlamak için büyük resmin temelleriyle baþlayalým. Tarih boyunca çeþitli insan gruplarý (örneðin kabileler, krallýklar, ülkeler, vs.) zenginlik ve gücü kendileri inþa ederek, baþkalarýndan alarak ya da toprakta bularak elde etmiþlerdir.
Ülke en büyük ticaret imparatorluðu haline gelmek için uluslararasý iliþkilerini geniþlettikçe, iþlemleri kendi para biriminde ödenebilir ve dünyanýn dört bir yanýndaki insanlar bu para biriminde tasarruf etmek ister, böylece dünyanýn önde gelen rezerv para birimi haline gelir, bu da ülkenin diðer ülkelerden daha fazla ve daha düþük oranlarda borç almasýný saðlar, çünkü diðerleri bu para biriminde borç vermek ister.
Ülke en büyük ticaret imparatorluðu haline gelmek için uluslararasý iliþkilerini geniþlettikçe, iþlemleri kendi para biriminde ödenebilir ve dünyanýn dört bir yanýndaki insanlar bu para biriminde tasarruf etmek ister, böylece dünyanýn önde gelen rezerv para birimi haline gelir, bu da ülkenin diðer ülkelerden daha fazla ve daha düþük oranlarda borç almasýný saðlar, çünkü diðerleri bu para biriminde borç vermek ister. Karþýlýklý olarak birbirini destekleyen finansal, siyasi ve askeri güçlere yol açan bu neden/sonuç iliþkileri dizisi, kayýtlý tarih var olduðu sürece birlikte devam etmiþtir. Dünyanýn en güçlüsü haline gelen tüm imparatorluklar zirveye ulaþmak için bu yolu izlemiþtir.
"Daha zengin ülkeler, daha fazla tasarruf eden daha yoksul ülkelerden borç alarak borçlanýrlar; bu, servet ve güç kaymasýnýn ilk iþaretlerinden biridir. Bu durum 1980'lerde ABD’de, kiþi baþýna düþen gelirin Çin’in 40 katý olduðu ve dolar dünyanýn rezerv para birimi olduðu için dolarla tasarruf etmek isteyen Çinlilerden borç almaya baþladýðý zaman baþladý. Eðer imparatorluk yeni borç verenleri tüketmeye baþlarsa, para birimini elinde tutanlar satýn almak, tasarruf etmek, borç vermek ve girmek yerine satmaya ve çýkmaya bakmaya baþlarlar ve imparatorluðun gücü düþmeye baþlar."
Mevcut büyük güce ve mevcut dünya düzenine meydan okuyabilecek yükselen bir büyük güç olduðunda, özellikle de mevcut büyük güç içinde iç çatýþma yaþanýyorsa, büyük bir uluslararasý çatýþma riski artar. Tipik olarak yükselen uluslararasý rakip bu iç zayýflýktan faydalanmaya çalýþacaktýr. Bu durum özellikle de yükselen uluslararasý güç benzer bir ordu kurmuþsa risklidir.
