"John, altmýþlý yaþlarýnýn sonlarýna gelmiþ, üç yetiþkin çocuk ve iki torun sahibi bir bireydir. Boþanmýþ ve köpeðiyle birlikte yalnýz yaþamaktadýr. Ayný zamanda, haftada birkaç kez buluþtuðu bir kýz arkadaþý da var. Küçük bir emlak portföyüne sahip (sadece konut) ve ayda birkaç saatini mülklerini yönetmeye ayýrýyor. Çoðu iþi dýþarýdan halletse de, kiracýlarla iletiþimde kalmayý tercih ediyor. Bu nedenle, yýlda bir defa onlarý ziyaret ediyor. Aslýnda John ile böyle tanýþtým; o eskiden benim ev sahibimdi. Onun iyi bir insan olduðunu düþünüyordum ve ondan öðrenebileceðim þeyler olduðuna inanýyordum. Hayatý gerçekten güzel: çalýþmak zorunda deðil, geniþ bir evde yaþýyor, çocuklarý ve torunlarýyla zaman geçiriyor ve hava güzel olduðunda teknesi ile deniz açýlýyor zaman zaman. Ona nasýl baþladýðýný sorduðumda “Hayatým her zaman böyle geçmedi,” dedi. Babasýnýn maddi durumu iyiydi fakat zengin sayýlmazdý. John’un bazý avantajlarý olmasýna raðmen, zengin bir ailede doðmamýþtý açýkçasý. Üniversiteyi bitirdikten sonra birçok farklý iþte çalýþtý ve kendi iþini kurmanýn gerekliliðini fark etti. O zamanlar evliydi ve bir çocuðu vardý, ancak bu onun önünde bir engel teþkil etmedi. Bir eðitim ve geliþtirme þirketi kurarak, liderlik, iletiþim, satýþ, takým çalýþmasý gibi çeþitli konularda iþletmelere seminerler düzenledi. Sonrasýnda, bu iþi yürütmek üzere eðitmenler iþe aldý. Þirketi kurmak için neredeyse yirmi yýlýný harcadý. “Her zaman iþteydim ve bundan daima zevk aldým. Fakat çocuklarýmýn çocukluklarýnýn büyük bir kýsmýný kaçýrdým.” Ama yine de çok çalýþma kararýndan piþman deðildi. O, bunu zengin olmanýn bedeli olarak görüyor. Kendi iþini kurdu ve iþ imkanlarý yarattý. Çocuklarý iyi durumdalar; üniversite eðitimi aldýlar, ikisi iyi iþlere sahip ve biri kendi baþarýlý iþini yönetiyor. Çocuklarýnýn ve torunlarýnýn hayatý þimdi daha iyi. Ancak, büyüdüklerinde babalarýnýn yanlarýnda olmamasýndan pek memnun deðillerdi."
"Ýþte o, kýrklý yaþlarýnda böylelikle zenginliðe ulaþtý. Daha sonra, birkaç yýl boyunca geçici yönetici olarak görev yaptý. Sorunlu þirketleri ziyaret edip onlarý iyileþtirmeye çalýþtý. Ancak, zamanla bu iþten de sýkýldý ve bir daha yeni bir iþe girmedi. Yýllar içinde, þu an yaklaþýk yirmi birimden oluþan bir emlak portföyü geliþtirdi. Ýþini satýp daha fazla gelir elde ettikten sonra, bugün hala dahil olduðu bir gayrimenkul yatýrým ortaklýðýna katýldý. Teknesi ve sanat eserleri koleksiyonuna olan düþkünlüðü dýþýnda, gösteriþsiz bir yaþam sürüyor ve yýllardýr ayný station wagon aracýný kullanýyor. Onun varlýðýnýn ne kadar olduðunu asla sormadým, ancak portföyünü ve ortaklýðýný biliyorum; yaklaþýk 3 milyon dolar deðerinde olduðunu düþünüyorum."
John’un hikayesi olaðandýþý deðil elbette. Az birikimle baþlayýp zengin olan birçok kiþinin benzer öyküleri var. Milyoner startup kurucularýnýn ya da Bitcoin spekülatörlerinin baþarý hikayeleri her yerde karþýmýza çýkabilir. Bu durum, zenginliðin sanki bir piyango kazanýmýymýþ gibi olduðunu düþündürüyor. Ancak bu, yanlýþ bir düþünce. Birçok zengin insan için bu, katlanýlmasý gereken bir sýkýntýdýr ve bu sýkýntýnýn bir maliyeti vardýr. Az sayýda insan þans eseri zengin olur. Zengin olmayý arzuluyorsanýz, kendinize þu soruyu sormalýsýnýz: Bu bedeli ödemeye hazýr mýyým? Fakat bir sonraki vaka çalýþmasýyla kýyaslandýðýnda, bu önemsiz kalýyor.
Brian (elli yaþlarýnýn sonunda), tanýdýðým en baþarýlý iþ insanlarýndan biridir. Binlerce çalýþaný olan uluslararasý bir üretim þirketine sahip. Tahminimce Brian’ýn net deðeri yaklaþýk 50 milyon dolar, belki de daha fazla. Bir malikanesi, lüks otomobilleri, yurtdýþýnda tatil evleri ve çeþitli iþ ve gayrimenkul yatýrýmlarý bulunmaktadýr. Kiþisel yaþamý o kadar parlak deðildi. Kýrklarýnýn baþýnda eþini yitirdi ve yakýnlarý bunun onu derinden etkilediðini belirtiyor. Tekrar evlenmesi yaklaþýk on sekiz yýl aldý. Açýkçasý, kiþisel yaþamý hakkýnda çok fazla bilgim yok. Ýþ dolayýsýyla tanýþtýk ve kiþisel meseleler üzerine hemen hemen hiç konuþmadýk. Ayrýca, Brian’ýn bazý arkadaþlarýný da tanýyorum. Filmleri ve arabalarý sevdiðini, ancak spor yapmayý, seyahat etmeyi veya okumayý tercih etmediðini biliyorum. Bildiðim kadarýyla baþka hobileri de yok. Golf oynuyor, ancak bu sadece diðer zenginlerin de oynadýðý içinmiþ gibi görünüyor.
"Brian, iþçi sýnýfýndan gelen bir ailenin tek çocuðu olarak büyümüþtür. Baþarýlý bir mühendislik kariyerini takiben, otuzlarýnýn sonunda kendi üretim þirketini kurmuþtur. Ýþ dünyasýnda oldukça rekabetçi ve agresif bir tutuma sahiptir. Þirketin gelirini beþ yýl içinde sýfýr milyondan on milyona yükseltti. Bu nadiren görülen bir baþarýdýr. Yýlýn her günü çalýþtýðýna (bu bir abartý deðil bu arada) þaþýrmamak gerekir. Arkadaþlarý onun sadece bunu yaptýðýný söylüyorlar. Dünya çapýnda ofisleri bulunuyor ve son beþ yýlda kendi alanýndaki birçok þirketi bünyesine katmýþtýr. Ona yaptýðý iþi neden sevdiðini sorduklarýnda, “Ýþi seviyorum” diye yanýtlamýþtýr. Ýþte bu adam böyle biri; durmadan çalýþýyor. Ancak tamamen kendi çabasýyla buraya gelmedi. Ýþe baþlarken, yatýrým yapan baþarýlý bir mentoru ve iþ ortaðý vardý. Bugün bile hala ortaklar ve bu tür bir destek olmadan bu kadar agresif bir tutum sergileyemezdi."
O, ayný zamanda çatýþmayý seven bir adamdýr. Bir defasýnda, onun piyasadaki baþka bir büyük isimle yaþadýðý bir anlaþmazlýða þahit oldum. Yýllardýr sektörde olan ve o sýralar kendisinden çok daha büyük bir rakip hakkýnda, “Onlar kim olursa olsun, umurumda deðil. Kazanýncaya kadar pes etmeyeceðim.” demiþti.
"Brian’ýn hikayesi artýk daha da zenginleþti. Örneðin, hayýr kurumlarýna cömert baðýþlarda bulunuyor. Ne kadar baðýþ yaptýðýný bilmiyorum; çünkü kendisi bu konuda konuþmaz, bunu baþkalarýndan öðrendim. Bildiðim bir diðer þey ise, çalýþanlarýnýn çoðu yýllardýr onun için çalýþýyor ve o da onlara karþý oldukça iyi davranýyor. Ancak beni en çok etkileyen, zengin olmanýn farklý bir þey gerektirmesidir. Çok az insanýn yaptýðý þeyleri yapmak zorundasýnýz. Brian’ýn John’dan daha büyük bir bedel ödemeye hazýr olduðunu görebilirsiniz. Ancak maddi ödülleri de ona göre daha büyük. Yine de Brian’ý harekete geçirenin bu olduðunu sanmýyorum. O, sadece kazanmayý istiyor."
Bir kitabý bitirdikten sonra ne okuyacaðýma karar verirken, genellikle ikisi arasýnda mantýklý bir baðlantý olmaz. Ýç Savaþ hakkýnda bir tarih kitabýný bitirebilir ve ardýndan uzak gelecekte geçen bir bilim kurgu romanýna baþlayabilirim. Bu durum þovlar ve dizi-filmler için de geçerlidir: En ilgi çekici gelen þeye yönelirim.
"Bir öneri listesi oluþturduktan sonra, içlerinden geçen ortak bir tema olup olmadýðýný gözden geçirmek gerçekten eðlenceli olabiliyor. Bu sefer kesinlikle bir tema var. Yaz okuma listemdeki kitaplar ve diziler, baþkalarýna hizmet etme konusuna; bunu neden yaptýðýmýza, bu süreci zorlaþtýrabilecek etkenlere ve yine de bunu neden sürdürmemiz gerektiðine odaklanýyor. Bunlardan bir tanesi, Vietnam Savaþý’nýn cephelerinde görev yapan Amerikalý hemþirelerin özverilerini anlatan bir roman. Bir baþkasý, dijital çaðda cömertliði teþvik eden ve bunun yollarýný gösteren bir rehber. Diðerleri ise, insanlar arasý baðlarý derinlemesine irdeleyen ve okul öðretmenlerinin öðrencilere desteðinin evrimini ele alan eserler. Hatta listemdeki bir dizi, ülkelerini korumak için çalýþan hükümet görevlilerini merkezine alýyor."
Hizmet fikrinin ayrýntýlarýna dalmak niyetinde olmasam da, bu düþünce bugün her zamankinden daha fazla geçerliliðini koruyor. Savaþlarýn gündemi belirlediði ve siyasetin giderek daha fazla kutuplaþtýðý bir zamanda, baþkalarýna yardým edenleri övmek ve kendi hayatlarýmýzda nasýl daha cömert olabileceðimizi keþfetmek gerçekten ilham verici. Ýþte, her bir giriþ için daha detaylý incelemeler sunan baðlantýlar içeren listem.
"Casus hikayelerine bayýlýyorum. John le Carré’nin birkaç romanýný okudum ve “Casus Oyunu” ile “Akbabanýn Üç Günü” en sevdiðim filmler arasýnda yer alýyor. “Slow Horses” ise en iyiler arasýnda bir yerlere konulabilir. Bu dizi, MI5'ýn kurgusal bir birimi olan Slough House’a atanan ajanlarý anlatýyor; burasý, insanlarýn iþleri kötü yaptýklarýnda gönderildikleri, ancak kovulmayacak kadar da kötü olmayan bir yerdir. Gary Oldman, James Bond’un zýttý olan Slough House’un baþkanýný oynuyor. O, daðýnýk ve alkolik bir karakter ancak beklenmedik casusluk becerileriyle sizi þaþýrtabilir. Le Carré’nin romanlarý gibi, “Slow Horses” da karmaþýk karakterler ve fakat sonunda kanýmca olay örgüsüyle dikkatinizi çekmeyi baþarýyor."
Khan Academy’nin kurucusu Sal Khan, yapay zekanýn yükseliþi öncesinde bile eðitim teknolojisi alanýnda öncülük etmiþtir. Bu nedenle, “Cesur Yeni Sözler”de yapay zekanýn eðitimi nasýl geliþtireceðine dair sunduðu vizyon, saðlam bir temele oturuyor. Sal, yapay zekanýn öðrencilerin baþarýlarýna ve öðretmenlerin deneyimlerine radikal iyileþtirmeler getireceðini ve herkese birinci sýnýf eðitim eriþimi saðlayacaðýný iddia ediyor. Ýnovasyonun bugüne kadar sýnýfta yalnýzca sýnýrlý etkisi olduðunu kabul ederken, yapay zekanýn bu durumu deðiþtireceðine inanýyor. Eðitimin geleceði konusunda Sal’dan daha net bir anlayýþa sahip olan azdýr ve “Cesur Yeni Sözler”i þiddetle tavsiye ediyorum.
David’in önceki eseri ‘Karaktere Giden Yol’ hoþuma gitmiþti fakat bu kitap çok daha üstün. Temel tezi, baþka hiçbir kaynakta rastlamadýðým bir konu: Konuþma ve sosyal becerilerin doðuþtan gelen yetenekler olmadýðý, öðrenilip geliþtirilebileceðidir. Ayrýca, çevrenizdeki insanlarýn kendilerini dinlenmiþ ve deðerli hissetmelerini saðlayabilecek ‘yüksek sesle dinleme’ tekniði hakkýnda pratik öneriler sunuyor. Bir Ýnsaný Nasýl Tanýrsýnýz?, sadece daha iyi sohbetler için bir kýlavuz deðil, ayný zamanda daha baðlantýlý ve insan odaklý bir yaþam biçiminin reçetesidir.
Erteleme savaþý bir iç savaþtýr. Kiþisel hayatýmda bunun birçok örneðine þahit oldum. 2013 yýlýnda kariyerimin en zorlu dönemlerini yaþadým. Bundan iki yýl önce babamla bir þirket kurdum. Ancak iki yýl sonra çok mutsuz oldum çünkü daha fazlasýný yapmak ve daha fazla þey öðrenmek istiyordum. Bu yüzden bir süre serbest çalýþtým. Web siteleri kurdum, metin yazarlýðý, içerik pazarlamasý ve bazý tasarým çalýþmalarý yaptým. Ama yine olmadý. Peki niye? Rahatsýz edici bir iþ de yapmadým. Bunun yerine, bu zor görevlerden kaçmak için yeni bir iþ buldum.
Bir iþ kurmak veya kariyer yapmak zordur. Zor, sýkýcý ve tatmin edici olmayan iþler yapmanýzý gerektirebilir. Daha fazla müþteri veya iþ istiyorsanýz, kimse size hazýr tepside sunmayacaktýr ki acele etmelisiniz ve çok çalýþmalýsýnýz. Ýþinizi büyütmek için içerik pazarlamasý, bire bir satýþ, sosyal aðlarý yada hangi yöntemi kullanmak istiyorsanýz uygulamanýz gerekir. Kurumsal olmak istiyorsanýz, ittifaklar kurmanýz, stratejik olmanýz, hedeflerinizden daha iyi performans göstermeniz ve yaptýðýnýz iþte mükemmel olmanýz gerekir. Yapman gereken þey bu, deðil mi? Çoðumuz zaten bu þeyleri biliyoruz. Deðilse de bunlarý öðrenmeliyiz. Ýþ yerinde baþarýlý olmanýn sýrrý diye bir þey de yoktur esasýnda. Ancak genelimiz iþten kaçmayý tercih ediyoruz. Ve bu kaçýþ benim açýmdan ertelemenin özüdür. Ne yapman gerektiðini biliyorsun, ama yapmýyorsun. Bunun yerine, bir haber sitesi açýp, iþe yaramaz haberleri okumayý tercih ediyorsun. Veya fotoðraflardan çok hoþlanmasan da instagrama göz atýyorsun çünkü hayatýndan nefret ediyorsun. Belki Zara, H&M, Net-A-Porter, Bay Porter veya istediðiniz online maðazalara göz atýyorsun. Bu bir dereceye kadar benim de hayatýmýn bir parçasý. Örneðin, þimdi yeni bir kitap üzerinde çalýþýyorum. Konusuna hakimim ve ayný zamanda bir ünvaným da var yani profesyonelim. Ancak yazý yazmak benim için de çok zor. Bu yüzden rahatlamak için ben de bakarým. E-postalarýmý cevaplar, makaleler okur, kahve içerim, bazen online sitelerden alýþveriþ de yaparým ve iþimi yürütmek için sürekli tekrarlayan benzer iþler yaparým. Bu benim düzensiz olduðum anlamýna gelmez. Çünkü kendi iç düþmanýmla savaþýyorum.
Bugün Yap, Yarýn Deðil! Bunu kendimize sürekli hatýrlatmaya devam etmeliyiz. Ertelediðinizde, her zaman yarýn yapmak istersiniz. Hala öyledir benim içinde. Bence bu bize baðlý deðildir. Þimdi ve üç yýl önce aramýzdaki fark küçük ama basit: Üretken, mutlu ve amaçlý bir hayat yaþamak için sistemli olmaya güveniyor olmam. Eskiden iþleri nasýl halledeceðimi bilemezdim. Her zaman çabucak pes eder, sýkýþmýþ, mutsuz ve sinirli hissederdim. Ama þimdi, zorluklarý aþmanýn bir yolunu buldum.
Egzersiz yapmadýðým zaman huzursuz oluyorum, odaklanma sorunu, enerji ve güven eksikliði duyuyorum. Her gün beynimi ve vücudumu çalýþtýrarak, her zaman iç düþmanla savaþa hazýr oluyorum. Erteleme savaþýnýn üstesinden gelmenin, onunla savaþa giriþmeden baþladýðýný öðrendim. Askerler de eðitimsiz bir þekilde savaþa gitmiyor, deðil mi? Zihinsel ve fiziksel olarak formda olmalýyýz. Her zaman.
"Beynimi ihmal ederdim. Zihinsel olarak zayýfdým, çok düþünürdüm ve kendime güvenmezdim. Aslýnda öyle deðildi! Çünkü becerilerim yoktu. Çünkü olaylarý çözme yeteneðime güvenmezdim. Böylece Stoizm, Pragmatizm ve Farkýndalýk hakkýnda okumaya baþladým; Düþüncelerinizi kontrol etmenize ve zihinsel dayanýklýlýðýnýzý iyileþtirmenize yardýmcý olan herhangi bir þey, kitap vs. Düþüncelerimin kölesi olmak da istemiyorum. Tam tersini istiyorum."
Bugün esaretimin sekizinci ayý. Umarým bu mektubu kimse okumadan yakabilirim. Çünkü kaðýtlara hiç olmadýðým kadar dürüst davranýyorum, özellikle de son zamanlarda. Ýnan, sana olan hayranlýðým zerre azalmýyor. Ýri, kaba ve kalpsiz birkaç adam her gün ziyaretime geliyor. Beni devamlý hislerimi yalanlamaya zorluyorlar. Onlardan korkmuyorum, sadece çektirdikleri ýzdýrap beni çok yoruyor o kadar. Ama cesaretimi de bir türlü dizginleyemiyorum. Onlara durmadan senin benzersiz güzelliðini anlatýyorum. Bazýlarý delirdiðimi zannediyor. Hele bir tanesi var ki öfkesi topuklarýna çýkýyor, onun da sana yanýk olduðuna yemin edebilirim.
"Ýþte bunlar benim için yazýlmýþ sözlerdi. Yýllar önce bir gardiyan öfkesine hâkim olamamýþ ve Carlos'u öldürmüþ. Yazýlan mektup durumu tetiklemiþ olacak ki, katil gardiyan, onu uzun bir süre saklamýþ. Cezasý bitip hapisten çýkýnca da vicdanýndaki aðýrlýðý atamamýþ olacak ki mektubu bana vermiþ. O zamanlar gençtim, zavallý Carlos’un sözlerine pek kýymet vermemiþtim. Tüm ülkede dedikodu malzemesi haline geldiðini hatýrlýyorum. ""Prensese âþýk olmanýn cezasýný çekti."" diye konuþuluyordu Carlos’un arkasýndan."
Ertelemeye yönelik, her insanýn kendine has geliþtirdiði bir mekanizma bulunur. Kendini iyi tanýyan insanlar, ertelemeye çözüm bulma konusunda daha yaratýcý davranýrlar. Ben ise, her ertelemenin biyolojik bir sebebi olduðuna inanýrým. Bu biyolojik sebebi yaratan ve sonuçlara varan psikolojik etkenler ise kiþinin içinde bulunduðu ortama göre deðiþir.
Erteleme eylemi zihinde oluþmaya baþladýðýnda yaþanan hislere yüzeysel olarak sýralayalým: Ýç sýkýntýsý, bezginlik, tembellik, herhangi baþka bir arzu nesnesi, öz güven eksikliði. Farklý kombinasyonlar hâlinde sahip olabileceðimiz bu his gruplarý, yapýlacak eylemin karmaþasýna göre boyut deðiþtirir. Bu karmaþanýn üzerinden gelmek ve eylemi gerçekleþtirebilmek için motivasyona ihtiyaç duyarýz.
Manevi kazanç, çevresel etkenlerle deðiþen / geliþen biyolojik tepkimelerin ardýndan beyninizde oluþan algýnýzý þekillendirme tecrübenize baðlýdýr. Motivasyonun 1'in altýnda olmasý, eylemin ertelenmesine (bahane bulmaya) neden olur. Çoðu zaman, beyniniz sizin için ödül kazanma hissini soyut bir þekilde yaratýr. Yukarýda bahsettiðimiz hisleri farklý kombinasyonlarla deneyimlemenizi saðlar.
Beyindeki tetiklenmelerle oluþan erteleme hissini, ortalama 10 dakika süren “pes ettirmeye çalýþma” süreciyle deneyimlersiniz. Eylemin kendisinden baðýmsýz, bu süreyi eylemi gerçekleþtirmek için pes etmeden kullanabilirseniz, beyniniz sizin için “ödül” hissini oluþturur. Bu his sayesinde, eylemin tamamý için gerekli olan motivasyonu bulursunuz. Eylemin kendisi 10 dakikanýn altýnda biterse, zaten baþardýnýz demektir. Ýnsan psikolojisi manipülasyon üzerine çalýþýr. Bu yüzden, motivasyonun algýsýný þekillendirmek, bakýþ açýnýzý deðiþtirmenizle kolaylaþýr.
“Bir þeyler okuyacaðým” denildiðinde aklýnýza hep “kitap okumak” veya “yazý okumak” gelir. Aslýnda okuma eylemi sadece metin okumayý deðil, ayný zamanda görsel (film vb.) okumayý, bir þeyin anlamýný çözmeyi, yazý dýþýndaki iþaret ve izleri deðerlendirerek yorumlamayý kapsar. Her okuduðunuz þeyin anlamýný kavradýðýnýzý söylemek ise zordur. Çünkü herkesin okuduðu þey kendi anlam kümesinde farklý bir yorum kazanýr. Derin anlam kümelerini yorumlayabilmek ise çok fazla deneyim gerektirir. Zaman içerisinde farklý boyutlardaki anlam kümeleriyle girdiðiniz etkileþimin çeþidine göre kendi anlam kümenizi geniþletme imkaný yakalarsýnýz. Bu çeþitlilik farklý zamanlarda farklý biçimlere bürünerek karþýmýza tekrar çýkabilir.
Türkçede “aydýn”, sýkça “bilgili olan biri” olarak karþýmýza çýkýyor. Halbuki her bilgiyi anladýðýmýzdan bahsedemeyiz. Anlaþýlmayan bilgi ise deðerli sayýlmamalý. Bundan dolayý “okumuþ” anlamýnýn sözlükten kaldýrýlmasý icap eder. Fakat diðer anlamlarda da baðlamsal sorunlar göze çarpar. Mesela “görgülü” ve “kültürlü” bunlardan diðerleri. Bu anlam karýþýklýklarýný gidermek için sadece “anlamak” üzerinden kurulu bir çeviri deðiþikliði, “aydýn” için en geçerli deðiþim olacaktýr. Böylece her önüne gelen kendine “aydýn” demez ve Türkiye’deki aydýnlanma seviyesini mantýklý bir boyutta ölçebiliriz.
Görmeye alýþýk olduðumuz bu projeksiyon (izdüþüm)Merkatör projeksiyonudur. Ýzdüþüme adýný veren Felemenk Haritabilimci Gerardus Mercator, bu haritayý 1569’da hazýrladý. Haritanýn önemli ve popüler olmasýnýn arkasýnda gemicilik açýsýndan oldukça kullanýþlý olmasý var: Kerte hattýný esas alýyor. Kerte hattý, Dünya üzerindeki tüm meridyenleri ayný açýyla kesen bir eðridir ve gemiciler rota hesaplarýnda kerte hattýný esas alýrlar. Mercator projeksiyonu Dünya'yý kerte hatlarýný birbirine paralel düz çizgiler olarak gösterecek þekilde kutuplara doðru artacak þekilde germiþtir ve bu da gemicilere böyle bir haritaya göre hareket ettiklerinde Dünya’nýn þeklinden kaynaklanan hata paylarýný minimize etmelerini saðlar. Baþka bir deyiþle, gideceðiniz yerin Mercator haritasýna göre bulunduðu açýyý belirlerseniz, pusulayý hiç deðiþtirmeden sadece o yönde takip etmeniz yeterli olur. Dünya o sýrada döndüðü için, sabit olan tek yýldýza, yani kutup yýldýzýna göre sabit bir açý belirleyip ilerleseniz de Mercator haritasý bu sapmalarý çoktan hesaba katmýþ olacaktýr.
Açýkçasý Dünya’yý düz bir zeminde göstermek isteyen yani 2 boyutlu olan hiçbir izdüþümün Dünya’nýn gerçek durumunu birebir yansýtmasý mümkün deðildir. Gerardus Mercator’ün de bu haritayý hazýrlarken bu tip bir izdüþüm kullanmasýnda kerte hattýný esas alarak rota hesaplama iþlemlerinde vakit kazanmaktan baþka bir amacý olduðu söylenemez. Ancak 500 yýldýr bu haritanýn zaman zaman siyasi amaçlarla kullanýlageldiði iddia edilmektedir. En azýndan hala bu haritanýn kullanýmýnda ýsrarcý olmanýn…
Her þeyden önce bugün bildiðimiz pek çok harita Avrupa’yý merkeze almaktadýr. Hakikaten de, Dünya küreseldir ve merkez olarak Avrupa’yý seçmenin saðladýðý özel bir avantaj yoktur. Lakin ilk coðrafi keþiflerin avrupalýlarca yapýldýðý ve ilk Dünya haritasýnýn avrupalýlar tarafýndan çizildiði düþünülürse bu haritalarda Avrupa’nýn merkezde yer almasý gayet normal karþýlanabilir. Fakat sömürgeler çaðýnda bu entosantrik -yani bir etnik kökeni daha ön planda veya merkezde tutan durumun- birilerinin iþine yaramadýðý söylenemez: Örneðin “Güneþ’in batmadýðý imparatorluk” söylemlerinin meþhur olduðu dönemlerde Ýngiliz üretimi Dünya haritalarý baþka alternatifleri olmasýna karþýn Mercator izdüþümünden asla vazgeçmemiþlerdir. Ýngiltere’yi ve dominyonlarý olan Kanada ile Avustralya’yý olduðundan daha büyük gösteren, buna keza ekvatora yakýn olan Ýngiliz sömürgelerini gerçeðine uygun -yani görece daha küçük- resmeden, Ýngiltere’yi de Dünya’nýn tam merkezine koyan (0. boylam) Mercator haritalarý Ýngiltere’nin sömürge politikalarýnýn ve yaratmak istediði algýnýn görsel coðrafi zeminini oluþturuyordu. Bu yüzden baþta Ýngiltere olmak üzere geliþmiþ sömürgeci ülkeler, Mercator projeksiyonundan hiç vazgeçmemiþ ve eðitim politikalarýna da kolaylýkla müdahale edebildiði azgeliþmiþ ülkelere bu haritadan bol bol daðýtmýþlardýr.
Tüm sosyalbilimciler bu konuda ayný þeyi düþünmüyor. “Kerte Hattý ve Harita Savaþlarý” adlý kitabýn yazarý Mark Monmonier, Mercator projeksiyonunun emperyalizmin bir simgesi haline dönüþtüðünü kabul etmekle beraber bir haritanýn algý yönetiminde ya da emperyalizmin amaçlarýna ulaþmasýnda abartýldýðý kadar etkili olduðunu düþünmüyor. Dahasý, Mercator’ýn alternatifi Peters projeksiyonunun adaleti nasýl saðlayacaðýnýn da sorgulanmasý gerektiðini düþünüyor.
"Biz biraz daha eleþtirel olalým ve þunu da söyleyelim: Monmonier’in bakýþý yine de bir miktar “geliþmiþlik gözlüðündan bakmak” olarak deðerlendirilebilir; çünkü geliþmiþ ülkelerde sýradan vatandaþlarýn haritalarý pek taktýðý söylenemez; ama azgeliþmiþ ülkelerde bu olabilir. Her þeyden önce endüstri devrimini gerçekleþtirmiþ Avrupa ülkelerinin karþýsýnda hâlâ tarým toplumu olarak adlandýrabileceðimiz toplumlar vardý ve bu toplumlarýn “toprak miktarýný” önemli bir parametre olarak algýlama durumlarý olduðunu gözden kaçýrmayalým. Ayrýca haritalar azgeliþmiþlik içerisinde kendilerine çok daha derin anlamlar bulabilirler: Sözgelimi Türkiye’de bizler Afrika ülkelerini “sýnýrlarý cetvelle çizilmiþ” þeklinde telaffuz ettiðimiz bir metaforla aþaðýlama eðiliminde bir sosyal öðrenmeye maruz kalýyoruz. Bunun da açýlýmý söyledir: Afrika ülkeleri sýnýrlarýný savaþarak kazanmamýþlardýr ve sömürge ülkeleri masa baþýnda belirlemiþtir. Bu yüzden de cetvelle çizilmiþ þekilde düzdürler."
"Peters, ekvatora yakýn olan azgeliþmiþ ülkelerin kutuplara daha yakýn olan geliþmiþ ülkelere nispetle küçük görünmesinden rahatsýzdý ve bu durumun ülkelerin algýlanan önemlerini geliþmiþ ülkeler lehine bozduðunu düþünüyordu. Bu yüzden kendi haritasýný “yeni bir icat” olarak sundu; zira kendisinden önce baþta Gall’un olmak üzere pek çok haritabilimcinin alternatif önerdiðini, bu alternatiflerin hiçbirisinin geçerlilik kazanamadýðýný bilmiyordu. Yine de 60’lar ve 70’ler sosyal adalet konusunun akademik camiada popüler olduðu yýllardý; ve Peters’ýn kampanyasý daha önce getirmediði kadar ses getirdi. Belki Dünya’da Mercator projesinden vazgeçilmedi ama en azýndan Peters’ýn baþlattýðý tartýþmalar, uzun yýllar süren mücadelesi sonunda Amerikan Haritacýlarý Derneði’nin halký projeksiyonlar ve bu projeksiyonlarda kullanýlan eðim ve bükümler hakkýnda eðiten kitapçýklar yayýnlamasýný saðladý. 1989 ve 1990 yýllarýnda yedi Amerikalý coðrafya örgütü Mercator ve Peters dahil, “dikdörtgen dünya haritasý” kullanýmýný tedavülden kaldýrdýlar."
Haritanýn azgeliþmiþ ülkeler üzerinde geliþmiþ ülkeleri algýlayýþ biçimleri açýsýndan bir etkisi olup olmadýðý tartýþmalý olsa da günümüzde Peters projeksiyonunun gerçek alanlarý yansýtmakta çok çok daha baþarýlý olmasýna karþýn inatla kullanýlmadýðý, Mercator projeksiyonun kanýksandýðý, üstelik ilkokullarda bu manipülasyonun anlatýlmadýðý bariz gerçektir. Hepimiz kendi geçmiþimize dönüp bir bakabiliriz: Bu gerçeði bu yazýyla birlikte öðrenenlerimiz var deðil mi? Dünya’yý ve hayatý öðrenmeye baþladýðýmýz ilkokul sýralarýnda ve hatta ortaokul ve lise sýralarýnda dahi bize gerçeðin ne olduðundan pek bahsetmediler.
